{
  "$schema": "https://json-schema.org/draft/2020-12/schema",
  "title": "Pomiar wydajności, wersja 1",
  "description": "Kształt pomiaru czasu poleceń skryptów: co zmierzono, ile razy, z jakim wynikiem i na jakiej maszynie. Surowe czasy, bez statystyki: tę liczy zestawienie, które wolno zmienić bez migracji pomiarów.",
  "type": "object",
  "additionalProperties": false,
  "required": [
    "schema_version",
    "kind",
    "uid",
    "project",
    "finished",
    "commands",
    "environment",
    "migration_gaps"
  ],
  "properties": {
    "schema_version": {
      "type": "integer",
      "enum": [
        1
      ],
      "description": "Wersja schematu, według której czyta się ten plik. Wersje liczy się osobno w każdym rodzaju pomiaru."
    },
    "kind": {
      "type": "string",
      "enum": [
        "performance"
      ],
      "description": "Rodzaj pomiaru. Mówi, którego katalogu schematów użyć: schemas/performance/."
    },
    "uid": {
      "type": "string",
      "pattern": "^[0-9a-f]{32}$",
      "description": "Niepowtarzalny identyfikator uruchomienia testów wydajnościowych: UUID w wersji 4 zapisany bez myślników. Nadaje go samo uruchomienie, bo testy wydajnościowe idą także poza przebiegiem protokołu."
    },
    "project": {
      "$ref": "#/$defs/name",
      "description": "Nazwa projektu, czyli repozytorium developerskiego bez przyrostka."
    },
    "finished": {
      "$ref": "#/$defs/stamp",
      "description": "Kiedy uruchomienie testów się skończyło."
    },
    "commands": {
      "type": "array",
      "minItems": 1,
      "description": "Zmierzone polecenia, jedno wejście na wpis deskryptora.",
      "items": {
        "$ref": "#/$defs/command",
        "description": "Jedno polecenie wraz z czasami jego powtórzeń."
      }
    },
    "environment": {
      "$ref": "#/$defs/environment",
      "description": "Maszyna i jej obciążenie w chwili pomiaru. Bez tego dwóch pomiarów nie wolno porównywać."
    },
    "migration_gaps": {
      "type": "array",
      "description": "Czego migracja nie umiała dostarczyć. Pusta lista w pomiarze zapisanym od razu w tej wersji. Niepusta znaczy, że części wartości nie wolno ufać.",
      "items": {
        "$ref": "#/$defs/gap",
        "description": "Jeden brak."
      }
    }
  },
  "$defs": {
    "name": {
      "type": "string",
      "minLength": 1,
      "maxLength": 120,
      "pattern": "\\S",
      "description": "Krótki tekst do 120 znaków, niepusty."
    },
    "description": {
      "type": "string",
      "minLength": 1,
      "maxLength": 200,
      "pattern": "\\S",
      "description": "Tekst do 200 znaków, niepusty."
    },
    "stamp": {
      "type": "string",
      "pattern": "^\\d{8}T\\d{6}Z$",
      "description": "Znacznik czasu w postaci RRRRMMDDTGGMMSSZ, w czasie UTC."
    },
    "duration": {
      "type": "number",
      "minimum": 0,
      "description": "Czas trwania w milisekundach, tak jak wypisuje go pomiar czasu skryptu."
    },
    "command": {
      "type": "object",
      "additionalProperties": false,
      "required": [
        "file",
        "name",
        "arguments",
        "repetitions",
        "runs"
      ],
      "description": "Jedno polecenie deskryptora i to, co dało jego uruchomienie.",
      "properties": {
        "file": {
          "$ref": "#/$defs/name",
          "description": "Ścieżka pliku do uruchomienia, liczona od korzenia repozytorium developerskiego."
        },
        "name": {
          "$ref": "#/$defs/name",
          "description": "Nazwa polecenia, taka jak w odpowiedzi tego pliku na --usage."
        },
        "arguments": {
          "type": "array",
          "description": "Argumenty wywołania, gotowe do uruchomienia. Pusta lista, gdy polecenie ich nie bierze.",
          "items": {
            "$ref": "#/$defs/name",
            "description": "Jeden argument."
          }
        },
        "repetitions": {
          "type": "integer",
          "minimum": 1,
          "description": "Ile razy polecenie uruchomiono. Liczba pochodzi z wpisu deskryptora, bo polecenia różnią się czasem o rzędy wielkości."
        },
        "runs": {
          "type": "array",
          "minItems": 1,
          "description": "Kolejne uruchomienia tego polecenia, w kolejności wykonania.",
          "items": {
            "$ref": "#/$defs/run",
            "description": "Jedno uruchomienie."
          }
        }
      }
    },
    "run": {
      "type": "object",
      "additionalProperties": false,
      "required": [
        "duration_ms",
        "outcome",
        "spans"
      ],
      "description": "Jedno uruchomienie polecenia: czas odcinka korzenia i odcinki, które się w nim zawarły.",
      "properties": {
        "duration_ms": {
          "$ref": "#/$defs/duration",
          "description": "Czas odcinka korzenia, czyli całego uruchomienia."
        },
        "outcome": {
          "type": "string",
          "enum": [
            "ok",
            "error"
          ],
          "description": "Czy uruchomienie doszło do końca. Uruchomienie z błędem zostaje w pomiarze, bo jego czas też o czymś mówi."
        },
        "spans": {
          "type": "array",
          "description": "Odcinki potomne, spłaszczone: każdy mówi, w którym odcinku się zawiera. Pusta lista, gdy uruchomienie nie zmierzyło niczego poza sobą.",
          "items": {
            "$ref": "#/$defs/span",
            "description": "Jeden odcinek."
          }
        }
      }
    },
    "span": {
      "type": "object",
      "additionalProperties": false,
      "required": [
        "operation",
        "duration_ms",
        "span_id",
        "parent_span_id"
      ],
      "description": "Jeden pomiar czasu wypisany przez bibliotekę pomiaru czasu skryptu.",
      "properties": {
        "operation": {
          "$ref": "#/$defs/name",
          "description": "Stała nazwa mierzonej operacji."
        },
        "duration_ms": {
          "$ref": "#/$defs/duration",
          "description": "Czas trwania tej operacji."
        },
        "span_id": {
          "type": "string",
          "pattern": "^[0-9a-f]{16}$",
          "description": "Identyfikator tego odcinka: 16 znaków szesnastkowych."
        },
        "parent_span_id": {
          "type": "string",
          "pattern": "^[0-9a-f]{16}$",
          "description": "Odcinek, w którym ten się zawiera. Drzewo składa się po tym polu."
        }
      }
    },
    "environment": {
      "type": "object",
      "additionalProperties": false,
      "required": [
        "system",
        "release",
        "machine",
        "python",
        "cpu_count"
      ],
      "description": "Opis maszyny, zebrany wyłącznie biblioteką standardową.",
      "properties": {
        "system": {
          "$ref": "#/$defs/name",
          "description": "Nazwa systemu operacyjnego, z platform.system."
        },
        "release": {
          "$ref": "#/$defs/name",
          "description": "Wydanie systemu, z platform.release."
        },
        "machine": {
          "$ref": "#/$defs/name",
          "description": "Architektura maszyny, z platform.machine."
        },
        "python": {
          "$ref": "#/$defs/name",
          "description": "Wersja interpretera, z platform.python_version."
        },
        "cpu_count": {
          "type": "integer",
          "minimum": 1,
          "description": "Liczba rdzeni widzianych przez os.cpu_count."
        },
        "memory_bytes": {
          "type": "integer",
          "minimum": 0,
          "description": "Pamięć maszyny w bajtach, z os.sysconf. Pole opcjonalne: nie każdy system ją podaje."
        },
        "load_average": {
          "type": "number",
          "minimum": 0,
          "description": "Obciążenie maszyny z ostatniej minuty, z os.getloadavg. Pole opcjonalne: nie każdy system je podaje."
        }
      }
    },
    "gap": {
      "type": "object",
      "additionalProperties": false,
      "required": [
        "field",
        "from_version",
        "reason"
      ],
      "description": "Jeden brak powstały przy migracji.",
      "properties": {
        "field": {
          "$ref": "#/$defs/name",
          "description": "Nazwa pola, którego migracja nie umiała wypełnić treścią z pliku źródłowego."
        },
        "from_version": {
          "type": "integer",
          "minimum": 0,
          "description": "Wersja schematu, z której brak pochodzi."
        },
        "reason": {
          "$ref": "#/$defs/description",
          "description": "Dlaczego pola nie dało się wypełnić."
        }
      }
    }
  }
}
